{
  "format": "moonpi-project",
  "version": 1,
  "id": "10000000-0000-4000-8000-000000000001",
  "name": "Scripted GPIO blink",
  "board": {
    "definition": "moonpi.board.rpi3b-plus",
    "node_id": "10000000-0000-4000-8000-000000000002",
    "position": {
      "x": 80,
      "y": 60
    }
  },
  "nodes": [
    {
      "id": "10000000-0000-4000-8000-000000000003",
      "component": "moonpi.pin-script",
      "position": {
        "x": 920,
        "y": 100
      },
      "properties": {
        "script": "-- Connect an Interval tick to run to blink.\nif event == \"start\" then\n  pin.write(false)\nelseif event == \"input\" then\n  pin.write(value)\nelse\n  pin.write(not pin.read())\nend"
      }
    },
    {
      "id": "10000000-0000-4000-8000-000000000004",
      "component": "moonpi.interval",
      "position": {
        "x": 600,
        "y": 100
      },
      "properties": {
        "interval_ms": 500
      }
    }
  ],
  "edges": [
    {
      "id": "20000000-0000-4000-8000-000000000001",
      "kind": "hardware",
      "source": "10000000-0000-4000-8000-000000000002",
      "source_port": "header.11",
      "target": "10000000-0000-4000-8000-000000000003",
      "target_port": "signal"
    },
    {
      "id": "20000000-0000-4000-8000-000000000002",
      "kind": "hardware",
      "source": "10000000-0000-4000-8000-000000000002",
      "source_port": "header.6",
      "target": "10000000-0000-4000-8000-000000000003",
      "target_port": "ground"
    },
    {
      "id": "20000000-0000-4000-8000-000000000003",
      "kind": "logic",
      "source": "10000000-0000-4000-8000-000000000004",
      "source_port": "tick",
      "target": "10000000-0000-4000-8000-000000000003",
      "target_port": "run"
    }
  ]
}
