{
  "format": "moonpi-project",
  "version": 1,
  "id": "30000000-0000-4000-8000-000000000001",
  "name": "BME280 temperature alarm",
  "board": {
    "definition": "moonpi.board.rpi3b-plus",
    "node_id": "30000000-0000-4000-8000-000000000002",
    "position": {
      "x": 40,
      "y": 50
    }
  },
  "nodes": [
    {
      "id": "30000000-0000-4000-8000-000000000003",
      "component": "moonpi.sensor.bme280",
      "position": {
        "x": 560,
        "y": 40
      },
      "properties": {
        "address": 118
      }
    },
    {
      "id": "30000000-0000-4000-8000-000000000004",
      "component": "moonpi.interval",
      "position": {
        "x": 560,
        "y": 520
      },
      "properties": {
        "interval_ms": 500
      }
    },
    {
      "id": "30000000-0000-4000-8000-000000000005",
      "component": "moonpi.logic.compare",
      "position": {
        "x": 850,
        "y": 50
      },
      "properties": {
        "threshold": 25,
        "operation": "gt"
      }
    },
    {
      "id": "30000000-0000-4000-8000-000000000006",
      "component": "moonpi.led",
      "position": {
        "x": 1100,
        "y": 70
      },
      "properties": {
        "resistor_ohms": 1000
      }
    }
  ],
  "edges": [
    {
      "id": "30000000-0000-4000-8000-000000000100",
      "kind": "hardware",
      "source": "30000000-0000-4000-8000-000000000002",
      "source_port": "header.3",
      "target": "30000000-0000-4000-8000-000000000003",
      "target_port": "sda"
    },
    {
      "id": "30000000-0000-4000-8000-000000000101",
      "kind": "hardware",
      "source": "30000000-0000-4000-8000-000000000002",
      "source_port": "header.5",
      "target": "30000000-0000-4000-8000-000000000003",
      "target_port": "scl"
    },
    {
      "id": "30000000-0000-4000-8000-000000000102",
      "kind": "hardware",
      "source": "30000000-0000-4000-8000-000000000002",
      "source_port": "header.1",
      "target": "30000000-0000-4000-8000-000000000003",
      "target_port": "power"
    },
    {
      "id": "30000000-0000-4000-8000-000000000103",
      "kind": "hardware",
      "source": "30000000-0000-4000-8000-000000000002",
      "source_port": "header.6",
      "target": "30000000-0000-4000-8000-000000000003",
      "target_port": "ground"
    },
    {
      "id": "30000000-0000-4000-8000-000000000104",
      "kind": "hardware",
      "source": "30000000-0000-4000-8000-000000000002",
      "source_port": "header.11",
      "target": "30000000-0000-4000-8000-000000000006",
      "target_port": "signal"
    },
    {
      "id": "30000000-0000-4000-8000-000000000105",
      "kind": "hardware",
      "source": "30000000-0000-4000-8000-000000000002",
      "source_port": "header.6",
      "target": "30000000-0000-4000-8000-000000000006",
      "target_port": "ground"
    },
    {
      "id": "30000000-0000-4000-8000-000000000106",
      "kind": "logic",
      "source": "30000000-0000-4000-8000-000000000004",
      "source_port": "tick",
      "target": "30000000-0000-4000-8000-000000000003",
      "target_port": "read"
    },
    {
      "id": "30000000-0000-4000-8000-000000000107",
      "kind": "logic",
      "source": "30000000-0000-4000-8000-000000000003",
      "source_port": "temperature",
      "target": "30000000-0000-4000-8000-000000000005",
      "target_port": "input"
    },
    {
      "id": "30000000-0000-4000-8000-000000000108",
      "kind": "logic",
      "source": "30000000-0000-4000-8000-000000000005",
      "source_port": "value",
      "target": "30000000-0000-4000-8000-000000000006",
      "target_port": "set"
    }
  ]
}
